{
  "$schema": "https://json-schema.org/draft/2020-12/schema",
  "$id": "https://ecobin.local/contracts/onenet/command-envelope.schema.json",
  "title": "EcoBin OneNet command envelope",
  "type": "object",
  "required": [
    "schemaVersion",
    "commandUid",
    "commandType",
    "targetDeviceName",
    "target",
    "issuedAt",
    "expiresAt",
    "payloadSchemaVersion",
    "payloadSha256",
    "payload",
    "cosGrant"
  ],
  "additionalProperties": false,
  "properties": {
    "schemaVersion": { "const": 2 },
    "commandUid": {
      "$ref": "common.schema.json#/$defs/uuid"
    },
    "commandType": {
      "enum": [
        "APPLY_CONFIGURATION",
        "START_DELIVERY_SESSION",
        "START_CLEAN_OPERATION",
        "END_CLEAN_BEFORE_UNLOCK",
        "RESUME_CLEAN_OPERATION",
        "SAMPLE_FULLNESS",
        "MEASURE_EMPTY_BAG_BASELINE",
        "CONFIRM_EDGE_EVENT",
        "PROVIDE_PHOTO_UPLOAD_GRANT",
        "REQUEST_DEVICE_ACCEPTANCE",
        "AUTHORIZE_FACTORY_SEAL",
        "SYNC_DEVICE_ENTRY_URL",
        "START_MCU_FIRMWARE_UPDATE",
        "START_BUSINESS_RUNTIME_UPDATE",
        "CANCEL_BUSINESS_RUNTIME_UPDATE",
        "OPEN_REMOTE_SUPPORT_TUNNEL",
        "CLOSE_REMOTE_SUPPORT_TUNNEL"
      ]
    },
    "targetDeviceName": {
      "$ref": "common.schema.json#/$defs/deviceName"
    },
    "target": {
      "$ref": "common.schema.json#/$defs/target"
    },
    "issuedAt": {
      "$ref": "common.schema.json#/$defs/utcInstant"
    },
    "expiresAt": {
      "$ref": "common.schema.json#/$defs/utcInstant"
    },
    "payloadSchemaVersion": { "const": 2 },
    "payloadSha256": {
      "$ref": "common.schema.json#/$defs/sha256"
    },
    "payload": {
      "type": "object"
    },
    "cosGrant": {
      "oneOf": [
        { "$ref": "common.schema.json#/$defs/cosGrant" },
        { "type": "null" }
      ]
    },
    "downloadGrant": {
      "oneOf": [
        { "$ref": "common.schema.json#/$defs/downloadGrant" },
        { "type": "null" }
      ]
    }
  }
}
