{
  "commandType": "AUTHORIZE_FACTORY_SEAL",
  "commandUid": "8a000000-0000-4000-8000-000000000007",
  "cosGrant": null,
  "expiresAt": "2027-07-24T01:00:00.000Z",
  "issuedAt": "2026-07-24T01:00:00.000Z",
  "payload": {
    "acceptanceChallengeUid": "8a000000-0000-4000-8000-000000000003",
    "acceptanceEvidenceSha256": "c3b2ee98dbd0a630d73c65ac04ce1fccc5354bc692cec945c87426ba5e773fd5",
    "acceptanceEvidenceUid": "8a000000-0000-4000-8000-000000000001",
    "acceptanceGeneration": 1,
    "factoryBagRevision": 2,
    "factoryBagSetSha256": "aaaaaaaaaaaaaaaaaaaaaaaaaaaaaaaaaaaaaaaaaaaaaaaaaaaaaaaaaaaaaaaa",
    "hardwareSn": "SN-CONTRACT-0001",
    "sealAuthorizationSchemaVersion": 1
  },
  "payloadSchemaVersion": 2,
  "payloadSha256": "4fba4c89ac4ccc4ff973f18c0d580e738aed2639c27dd6e4b6f10c913bf6e351",
  "schemaVersion": 2,
  "target": {
    "type": "DEVICE_ASSET",
    "uid": "SN-CONTRACT-0001"
  },
  "targetDeviceName": "SN-CONTRACT-0001"
}
