{
  "commandType": "APPLY_CONFIGURATION",
  "commandUid": "20000000-0000-4000-8000-000000000002",
  "cosGrant": null,
  "expiresAt": "2026-07-24T01:01:00.000Z",
  "issuedAt": "2026-07-24T01:00:00.000Z",
  "payload": {
    "applicationUid": "10000000-0000-4000-8000-000000000002",
    "config": {
      "contentSha256": "a1a1a1a1a1a1a1a1a1a1a1a1a1a1a1a1a1a1a1a1a1a1a1a1a1a1a1a1a1a1a1a1",
      "mcuPayloadSha256": "ec5b3394e4a044a5f0aa7f328ba79135dc7d816369a046d71de81dec3adacba1",
      "version": 8
    },
    "deviceConfig": {
      "cleanSolenoidPulseMs": 1000,
      "continueDeliveryWaitMs": 30000,
      "deliveryAutoCloseMs": 120000,
      "deliveryDoorTravelWaitMs": 30000,
      "edgeHeartbeatIntervalMs": 3600000,
      "edgeHeartbeatMissThreshold": 3,
      "negativeWeightThresholdGrams": 500,
      "smokeMonitoringEnabled": true,
      "weightMeasurementTimeoutMs": 5000
    },
    "mcuConfigurationProfile": "UART_V2_SIMPLIFIED",
    "ports": [
      {
        "calibrationVersion": 4,
        "configuredFullWeightGrams": 50000,
        "displayName": "投口1",
        "enabled": true,
        "fullnessDistanceThresholdMm": 600,
        "fullnessEchoTimeoutUs": 30000,
        "fullnessMinimumValidSampleCount": 3,
        "fullnessMode": "SENSOR_OR_WEIGHT",
        "fullnessSampleCount": 5,
        "fullnessSensorKind": "ULTRASONIC",
        "fullnessSettleWaitMs": 5000,
        "portNo": 1,
        "unitPriceTenThousandths": 4501,
        "weightMaximumFluctuationGrams": 100,
        "weightMaximumGrams": 100000,
        "weightMeasurementTimeoutMs": 5000,
        "weightMinimumGrams": -5000,
        "weightRequiredSampleCount": 5,
        "weightStableWindowMs": 1500
      },
      {
        "calibrationVersion": 4,
        "configuredFullWeightGrams": 50000,
        "displayName": "投口2",
        "enabled": true,
        "fullnessDistanceThresholdMm": 600,
        "fullnessEchoTimeoutUs": 30000,
        "fullnessMinimumValidSampleCount": 3,
        "fullnessMode": "SENSOR_OR_WEIGHT",
        "fullnessSampleCount": 5,
        "fullnessSensorKind": "ULTRASONIC",
        "fullnessSettleWaitMs": 5000,
        "portNo": 2,
        "unitPriceTenThousandths": 4502,
        "weightMaximumFluctuationGrams": 100,
        "weightMaximumGrams": 100000,
        "weightMeasurementTimeoutMs": 5000,
        "weightMinimumGrams": -5000,
        "weightRequiredSampleCount": 5,
        "weightStableWindowMs": 1500
      }
    ]
  },
  "payloadSchemaVersion": 2,
  "payloadSha256": "e3ffef0e6928056bc3b2c474af6d1f49a15b55095fc472f6e02359ce8d5d43be",
  "schemaVersion": 2,
  "target": {
    "type": "CONFIGURATION_APPLICATION",
    "uid": "10000000-0000-4000-8000-000000000002"
  },
  "targetDeviceName": "SN-CONTRACT-0001"
}
