{
  "commandType": "MEASURE_EMPTY_BAG_BASELINE",
  "commandUid": "82000000-0000-4000-8000-000000000002",
  "cosGrant": null,
  "expiresAt": "2026-07-24T01:01:00.000Z",
  "issuedAt": "2026-07-24T01:00:00.000Z",
  "payload": {
    "bagUid": "40000000-0000-4000-8000-000000000002",
    "config": {
      "contentSha256": "aaaaaaaaaaaaaaaaaaaaaaaaaaaaaaaaaaaaaaaaaaaaaaaaaaaaaaaaaaaaaaaa",
      "mcuPayloadSha256": "bbbbbbbbbbbbbbbbbbbbbbbbbbbbbbbbbbbbbbbbbbbbbbbbbbbbbbbbbbbbbbbb",
      "version": 8
    },
    "emptyBagConfirmed": true,
    "measurementTimeoutMs": 6000,
    "measurementUid": "82000000-0000-4000-8000-000000000001",
    "portNo": 2
  },
  "payloadSchemaVersion": 2,
  "payloadSha256": "e479c03bde9bed23276d7554a53aa065419d1a5cba09638ab3b7904b8b81b271",
  "schemaVersion": 2,
  "target": {
    "type": "BASELINE_MEASUREMENT",
    "uid": "82000000-0000-4000-8000-000000000001"
  },
  "targetDeviceName": "SN-CONTRACT-0001"
}
