{
  "commandType": "START_BUSINESS_RUNTIME_UPDATE",
  "commandUid": "8e000000-0000-4000-8000-000000000003",
  "cosGrant": null,
  "downloadGrant": {
    "authorizationSequence": 1,
    "expiresAt": "2026-07-24T01:30:00.000Z",
    "url": "https://ecobin-business-private-1250000000.cos.ap-guangzhou.myqcloud.com/edge-runtime/releases/8e000000-0000-4000-8000-000000000001/package.tar.gz?authorization=CONTRACT_ONLY"
  },
  "expiresAt": "2026-07-24T01:01:00.000Z",
  "issuedAt": "2026-07-24T01:00:00.000Z",
  "payload": {
    "controlSequence": 1,
    "deploymentUid": "8e000000-0000-4000-8000-000000000002",
    "downloadTimeoutSeconds": 1800,
    "drainTimeoutSeconds": 1800,
    "maximumRetryCount": 3,
    "objectKey": "edge-runtime/releases/8e000000-0000-4000-8000-000000000001/package.tar.gz",
    "observationWindowSeconds": 1800,
    "packageSha256": "eeeeeeeeeeeeeeeeeeeeeeeeeeeeeeeeeeeeeeeeeeeeeeeeeeeeeeeeeeeeeeee",
    "packageSignatureBase64": "AAAAAAAAAAAAAAAAAAAAAAAAAAAAAAAAAAAAAAAAAAAAAAAAAAAAAAAAAAAAAAAAAAAAAAAAAAAAAAAAAAAAAA==",
    "packageSize": 1048576,
    "reason": "single-device validation",
    "releaseSequence": 13,
    "releaseUid": "8e000000-0000-4000-8000-000000000001",
    "signatureSha256": "f5a5fd42d16a20302798ef6ed309979b43003d2320d9f0e8ea9831a92759fb4b",
    "signingKeyId": "business-release-root-v1",
    "updateUid": "8e000000-0000-4000-8000-000000000004",
    "versionName": "1.1.0-rc.1"
  },
  "payloadSchemaVersion": 2,
  "payloadSha256": "b932b26cd4456e21ac0b2548af81306be860f13164f29cfcd6317cbe78812720",
  "schemaVersion": 2,
  "target": {
    "type": "BUSINESS_RUNTIME_DEPLOYMENT",
    "uid": "8e000000-0000-4000-8000-000000000002"
  },
  "targetDeviceName": "SN-CONTRACT-0001"
}
