{
  "commandType": "SYNC_DEVICE_ENTRY_URL",
  "commandUid": "8a000000-0000-4000-8000-000000000005",
  "cosGrant": null,
  "expiresAt": "2026-07-24T01:01:00.000Z",
  "issuedAt": "2026-07-24T01:00:00.000Z",
  "payload": {
    "deviceEntryUrl": "https://www.jinshoubao.com/device-entry/?deviceCode=Dv_contract000000000000000000000000",
    "deviceEntryUrlSha256": "1b08b21c2249d10e2bf707e9880a020322ed83036a9df47624ca3e31f79444cd"
  },
  "payloadSchemaVersion": 2,
  "payloadSha256": "b3464713e9ea67c8134a455bfd7e8c2da2e0e835113eb6d14398ef5566ae3244",
  "schemaVersion": 2,
  "target": {
    "type": "DEVICE_ASSET",
    "uid": "SN-CONTRACT-0001"
  },
  "targetDeviceName": "SN-CONTRACT-0001"
}
