{
  "commandType": "START_CLEAN_OPERATION",
  "commandUid": "81000000-0000-4000-8000-000000000001",
  "cosGrant": {
    "baseUrl": "https://ecobin-contract-1250000000.cos.ap-guangzhou.myqcloud.com",
    "bucket": "ecobin-contract-1250000000",
    "expiresAt": "2026-07-24T01:30:00.000Z",
    "grantUid": "71000000-0000-4000-8000-000000000003",
    "keyPrefix": "ecobin/clean-operation/40000000-0000-4000-8000-000000000001/",
    "region": "ap-guangzhou",
    "sessionTokenParts": [
      "TOKEN_3_PART_1",
      "TOKEN_3_PART_2"
    ],
    "tmpSecretId": "TMP_SECRET_ID_3",
    "tmpSecretKey": "TMP_SECRET_KEY_3"
  },
  "expiresAt": "2026-07-24T01:01:00.000Z",
  "issuedAt": "2026-07-24T01:00:00.000Z",
  "payload": {
    "config": {
      "contentSha256": "aaaaaaaaaaaaaaaaaaaaaaaaaaaaaaaaaaaaaaaaaaaaaaaaaaaaaaaaaaaaaaaa",
      "mcuPayloadSha256": "bbbbbbbbbbbbbbbbbbbbbbbbbbbbbbbbbbbbbbbbbbbbbbbbbbbbbbbbbbbbbbbb",
      "version": 8
    },
    "newBagUid": "40000000-0000-4000-8000-000000000002",
    "oldBagUid": null,
    "oldBaselineWeightGrams": null,
    "operationUid": "40000000-0000-4000-8000-000000000001",
    "operationWindowMs": 1800000,
    "portNo": 2,
    "recoveryGeneration": 0
  },
  "payloadSchemaVersion": 2,
  "payloadSha256": "a5f6988488b075a2ff38358248322dbc950e962252dedb458d416ed7def351d6",
  "schemaVersion": 2,
  "target": {
    "type": "CLEAN_OPERATION",
    "uid": "40000000-0000-4000-8000-000000000001"
  },
  "targetDeviceName": "SN-CONTRACT-0001"
}
