{
  "commandType": "CONFIRM_EDGE_EVENT",
  "commandUid": "60000000-0000-4000-8000-000000000002",
  "cosGrant": null,
  "expiresAt": "2026-07-24T01:01:00.000Z",
  "issuedAt": "2026-07-24T01:00:00.000Z",
  "payload": {
    "confirmationUid": "60000000-0000-4000-8000-000000000001",
    "effectKind": "CREATED",
    "errorCode": null,
    "originalEventUid": "30000000-0000-4000-8000-000000000006",
    "originalPayloadSha256": "427ffe8ec4d4c6ec17729339142da80b86521b8dc37930f23ae998f8da7b2d01",
    "outcome": "BUSINESS_APPLIED",
    "processedAt": "2026-07-24T01:00:31.000Z",
    "quarantineUid": null,
    "resultReferences": [
      {
        "key": "DO202607240001",
        "type": "DELIVERY_ORDER"
      }
    ]
  },
  "payloadSchemaVersion": 2,
  "payloadSha256": "bf5fe266dd4921b308b03638d8740d1e39ec54dd666b952f0db63fcb4a38d856",
  "schemaVersion": 2,
  "target": {
    "type": "EDGE_EVENT",
    "uid": "30000000-0000-4000-8000-000000000006"
  },
  "targetDeviceName": "SN-CONTRACT-0001"
}
